{
  "id": "passbook-agentA-0001",
  "agent": {
    "name": "Agent A",
    "unit": "Reconnaissance",
    "contact": "agent.a@nanda.example"
  },
  "issued_at": "2024-06-01T12:00:00Z",
  "entries": [
    {
      "timestamp": "2024-06-02T09:15:00Z",
      "event": "Passbook issued",
      "authority": "HQ Registrar",
      "notes": "Initial issuance"
    },
    {
      "timestamp": "2024-06-05T14:32:00Z",
      "event": "Clearance verified",
      "authority": "Operations Control",
      "notes": "Validated for field deployment"
    }
  ],
  "checksum": "c0ffee89"
}
